{"cap":128,"completion_count":1,"completion_set_hash":"73835e681c01fc579ee4fcf09191d0d96f3e0ec446a7f1c77b51dc945d1bd0d2","completions":[{"choices":{},"completion_id":"completion:29872c3be59b7fc5bc61","contract_hash":"d74b47c792432c1b1001b9b07109ea4dceb9967b9b480b510f635d74c74a5c4b"}],"deduplicated_count":0,"dimension_count":0,"enumerated_choice_vectors":1,"mode":"EXACT_ENUMERATION","sampled":false,"status":"IDENTIFIED"}
